run_date,provider,endpoint,calls_attempted,calls_success,calls_failed,rate_limited,limit_window,limit_value,credits_used,symbols_requested,symbols_loaded,stopped_after_429,retry_after_seconds,http_status,error_type,function,outputsize,adjusted,actual_endpoint,production_enabled,premium_blocked,message
2026-06-20,fred,series_observations,7,7,0,False,run,10,7,"DGS10,DGS2,DGS3MO,DFF,CPIAUCSL,PCEPI,UNRATE","DGS10,DGS2,DGS3MO,DFF,CPIAUCSL,PCEPI,UNRATE",False,,,,,,,series_observations,True,False,DGS10: DGS10: 365 rows; DGS2: DGS2: 365 rows; DGS3MO: DGS3MO: 365 rows; ...
2026-06-20,invesco,qqq_holdings,1,1,0,False,run,3,1,QQQ,QQQ,False,,,,,,,qqq_holdings,True,False,holdings rows=103
2026-06-20,fmp,diagnostic_only,0,0,0,False,day,250,0,,,False,,,,,,,diagnostic_only,False,False,FMP production quote collection disabled; use provider capability probe
2026-06-20,twelve_data,quote,20,20,0,False,minute,8,20,"NVDA,AAPL,MU,MSFT,AMZN,AMD,GOOGL,TSLA,GOOG,AVGO,INTC,META,WMT,AMAT,LRCX,CSCO,COST,KLAC,NFLX,SNDK","NVDA,AAPL,MU,MSFT,AMZN,AMD,GOOGL,TSLA,GOOG,AVGO,INTC,META,WMT,AMAT,LRCX,CSCO,COST,KLAC,NFLX,SNDK",False,,200.0,success,,,,quote,True,False,NVDA: quote loaded on round 1; AAPL: quote loaded on round 1; MU: quote loaded on round 1; MSFT: quote loaded on round 1; AMZN: quote loaded on round 1; ...
2026-06-20,alpha_vantage,not_called,0,0,0,False,day,25,0,,,False,,,,,,,not_called,True,False,provider not called in this daily pipeline run
2026-06-20,tiingo,not_called,0,0,0,False,hour,50,0,,,False,,,,,,,not_called,True,False,provider not called in this daily pipeline run
